{"name": "msl_role_discard", "description": "MSL title should always be discarded regardless of company or accuracy", "input": {"contact": {"zoominfo_id": "z001", "first_name": "Sarah", "last_name": "Chen", "job_title": "Medical Science Liaison, Respiratory", "company_name": "Pharma Co B", "email": "s.chen@example-pharma-b.com", "accuracy_score": 95, "employment_history": [{"title": "MSL, Oncology", "company": "Pharma Co H"}, {"title": "Medical Science Liaison", "company": "Pharma Co G"}]}, "brief": {"drug_brand": "Farxiga", "drug_generic": "dapagliflozin", "condition_full": "heart failure", "condition_acronym": "HF", "therapeutic_area": "Cardiology, Metabolic", "manufacturer": "AstraZeneca", "campaign_type": "drug-specific", "target_quota": 30}, "intel": {"pipeline_summary": "AZ has active HF program with multiple ongoing trials", "rwe_signals": ["Published DAPA-HF RWE follow-up studies"], "key_programs": ["DAPA-HF", "DELIVER"], "messaging_angles": ["Post-marketing RWE for HF-rEF/HF-pEF outcomes"]}}, "expected": {"decision": "discard", "discard_reason": "msl_role", "tier": null}}
{"name": "biomarker_discard", "description": "Biomarker discovery title signals non-RWE researcher", "input": {"contact": {"zoominfo_id": "z002", "first_name": "James", "last_name": "Park", "job_title": "Director, Biomarker Sciences & Translational Medicine", "company_name": "Pharma Co E", "email": "j.park@example-pharma-e.com", "accuracy_score": 92, "employment_history": [{"title": "Sr. Scientist, Biomarkers", "company": "Pharma Co U"}, {"title": "Research Scientist, Oncology", "company": "Pharma Co D"}]}, "brief": {"drug_brand": "Ocrevus", "drug_generic": "ocrelizumab", "condition_full": "multiple sclerosis", "condition_acronym": "MS", "therapeutic_area": "Neurology", "manufacturer": "Genentech", "campaign_type": "drug-specific", "target_quota": 25}, "intel": {"pipeline_summary": "Ocrevus established; next-gen anti-CD20 in Phase 2", "rwe_signals": ["Published MS registry studies"], "key_programs": ["Ocrevus RWE initiative"], "messaging_angles": ["Long-term safety/effectiveness data needs"]}}, "expected": {"decision": "discard", "discard_reason": "biomarker_discovery", "tier": null}}
{"name": "low_accuracy_discard", "description": "Pre-filter: accuracy below 85 must be discarded without LLM call", "input": {"contact": {"zoominfo_id": "z003", "first_name": "Tom", "last_name": "Rivera", "job_title": "VP, Real World Evidence", "company_name": "Pharma Co J", "email": "t.rivera@example-pharma-j.com", "accuracy_score": 70, "employment_history": [{"title": "Director RWE", "company": "Pharma Co J"}]}, "brief": {"drug_brand": "Dupixent", "drug_generic": "dupilumab", "condition_full": "atopic dermatitis", "condition_acronym": "AD", "therapeutic_area": "Dermatology, Immunology", "manufacturer": "Sanofi", "campaign_type": "drug-specific", "target_quota": 30}, "intel": {"pipeline_summary": "Dupixent label expansion ongoing", "rwe_signals": [], "key_programs": [], "messaging_angles": []}}, "expected": {"decision": "discard", "discard_reason": "low_accuracy", "tier": null}}
{"name": "no_email_discard", "description": "Pre-filter: no valid email must be discarded without LLM call", "input": {"contact": {"zoominfo_id": "z004", "first_name": "Lisa", "last_name": "Wong", "job_title": "Sr. Director, HEOR & Real World Evidence", "company_name": "Pharma Co D", "email": null, "accuracy_score": 94, "employment_history": [{"title": "Director HEOR", "company": "Pharma Co P"}, {"title": "Sr. Manager Health Economics", "company": "Pharma Co S"}]}, "brief": {"drug_brand": "Opdivo", "drug_generic": "nivolumab", "condition_full": "non-small cell lung cancer", "condition_acronym": "NSCLC", "therapeutic_area": "Oncology", "manufacturer": "BMS", "campaign_type": "drug-specific", "target_quota": 40}, "intel": {"pipeline_summary": "BMS IO portfolio strong in NSCLC", "rwe_signals": ["Multiple CheckMate RWE publications"], "key_programs": ["CheckMate RWE"], "messaging_angles": []}}, "expected": {"decision": "discard", "discard_reason": "no_valid_email", "tier": null}}
{"name": "ideal_rwe_coe", "description": "VP with RWE CoE title and strong history should be ideal tier", "input": {"contact": {"zoominfo_id": "z005", "first_name": "Diana", "last_name": "Marsh", "job_title": "Sr. Director, Real World Evidence Center of Excellence", "company_name": "Pharma Co H", "email": "d.marsh@example-pharma-h.com", "accuracy_score": 97, "employment_history": [{"title": "Director, Real World Data", "company": "Pharma Co B"}, {"title": "Principal Scientist, HEOR", "company": "Pharma Co G"}, {"title": "Health Outcomes Research Analyst", "company": "Pharma Co R"}]}, "brief": {"drug_brand": "Eliquis", "drug_generic": "apixaban", "condition_full": "atrial fibrillation", "condition_acronym": "AFib", "therapeutic_area": "Cardiology, Hematology", "manufacturer": "Pfizer", "campaign_type": "drug-specific", "target_quota": 30}, "intel": {"pipeline_summary": "Eliquis post-marketing lifecycle; next-gen anticoagulant in Phase 3", "rwe_signals": ["Extensive AFib RWE published; ARIS-AF registry ongoing"], "key_programs": ["ARIS-AF"], "messaging_angles": ["Post-approval safety/effectiveness for AFib population"]}}, "expected": {"decision": "keep", "tier": "ideal", "discard_reason": null}}
{"name": "strong_heor_director", "description": "Director HEOR with domain history and no red flags should be strong tier", "input": {"contact": {"zoominfo_id": "z006", "first_name": "Marcus", "last_name": "Lee", "job_title": "Director, Health Economics & Outcomes Research", "company_name": "Pharma Co I", "email": "m.lee@example-pharma-i.com", "accuracy_score": 91, "employment_history": [{"title": "Sr. Manager Health Economics", "company": "Pharma Co Q"}, {"title": "HEOR Analyst", "company": "Pharma Co V"}]}, "brief": {"drug_brand": "Dupixent", "drug_generic": "dupilumab", "condition_full": "asthma", "condition_acronym": "asthma", "therapeutic_area": "Pulmonology, Immunology", "manufacturer": "Regeneron", "campaign_type": "drug-specific", "target_quota": 25}, "intel": {"pipeline_summary": "Dupixent asthma approval; label expansion in pediatrics", "rwe_signals": ["Published HEOR models for Dupixent"], "key_programs": [], "messaging_angles": []}}, "expected": {"decision": "keep", "tier": "strong", "discard_reason": null}}
{"name": "indication_mismatch_discard", "description": "VP Medical Affairs with oncology-only career discarded for respiratory campaign", "input": {"contact": {"zoominfo_id": "z007", "first_name": "Rachel", "last_name": "Kim", "job_title": "VP Medical Affairs", "company_name": "Pharma Co B", "email": "r.kim@example-pharma-b.com", "accuracy_score": 93, "employment_history": [{"title": "Director Medical Affairs Oncology", "company": "Pharma Co D"}, {"title": "Sr. Medical Director, Oncology", "company": "Pharma Co H"}, {"title": "Medical Director, Heme-Onc", "company": "Pharma Co G"}]}, "brief": {"drug_brand": "Breztri", "drug_generic": "budesonide/glycopyrrolate/formoterol", "condition_full": "chronic obstructive pulmonary disease", "condition_acronym": "COPD", "therapeutic_area": "Pulmonology, Respiratory", "manufacturer": "AstraZeneca", "campaign_type": "drug-specific", "target_quota": 30}, "intel": {"pipeline_summary": "Breztri approved; AZ COPD pipeline deep", "rwe_signals": [], "key_programs": [], "messaging_angles": []}}, "expected": {"decision": "discard", "discard_reason": "indication_mismatch", "tier": null}}
{"name": "sales_commercial_discard", "description": "VP Sales background should be discarded as non-research buyer", "input": {"contact": {"zoominfo_id": "z008", "first_name": "Kevin", "last_name": "Torres", "job_title": "VP, Commercial Strategy & Market Access", "company_name": "Pharma Co J", "email": "k.torres@example-pharma-j.com", "accuracy_score": 89, "employment_history": [{"title": "Director, Brand Management", "company": "Pharma Co F"}, {"title": "Sr. Manager, Sales", "company": "Pharma Co T"}, {"title": "Sales Representative", "company": "Pharma Co H"}]}, "brief": {"drug_brand": "Aubagio", "drug_generic": "teriflunomide", "condition_full": "multiple sclerosis", "condition_acronym": "MS", "therapeutic_area": "Neurology", "manufacturer": "Sanofi", "campaign_type": "condition-specific", "target_quota": 20}, "intel": {"pipeline_summary": "Aubagio mature; Sanofi MS pipeline includes tolebrutinib", "rwe_signals": [], "key_programs": [], "messaging_angles": []}}, "expected": {"decision": "discard", "discard_reason": "sales_commercial", "tier": null}}
